{
  "schema_version": 1,
  "note_id": "77777777-7777-4777-8777-777777777777",
  "owner_id": "33333333-3333-4333-8333-333333333333",
  "run_id": "66666666-6666-4666-8666-666666666666",
  "host_id": "lab-global-primary",
  "software_id": "ops-core",
  "environment": "lab",
  "from_version": "1.2.2",
  "to_version": "1.2.3",
  "source": {"kind": "file", "origin": "fixtures/knowledge.json", "version": null, "digest": "ffffffffffffffffffffffffffffffffffffffffffffffffffffffffffffffff"},
  "problem": "none observed",
  "resolution": "read-only verification completed",
  "evidence_refs": ["results/software-check-1"],
  "confidence": "verified",
  "created_at": "2026-09-10T00:00:00Z",
  "author_provenance": "owner:33333333-3333-4333-8333-333333333333"
}
